deck_id,word,phonetic,part_of_speech,definition,example_sentence
deck_001,Mitigate,/ˈmɪt.ɪ.ɡeɪt/,verb,To make something less severe or harmful,We need to mitigate the risks associated with this project.
deck_001,Ubiquitous,/juːˈbɪk.wɪ.təs/,adjective,Seeming to be everywhere,Smartphones have become ubiquitous in modern society.
deck_002,Revenue,/ˈrev.ə.nuː/,noun,The income that a government or company receives regularly,The company's revenue increased by 20% last quarter.
deck_002,Implement,/ˈɪm.plə.ment/,verb,To start using a plan or system,The changes to the national health system will be implemented next year.
deck_003,Leverage,/ˈliː.vɚ.ɪdʒ/,verb,To use something that you already have in order to achieve something new or better,We can leverage our existing network to find new clients.
deck_003,Stakeholder,/ˈsteɪkˌhoʊl.dɚ/,noun,A person or group that has an investment or interest in a business,We must ensure all stakeholders are informed of the changes.
deck_004,Itinerary,/aɪˈtɪn.ə.rer.i/,noun,A detailed plan or route of a journey,The tour operator will provide you with an itinerary and flight tickets.
deck_004,Accommodation,/əˌkɑː.məˈdeɪ.ʃən/,noun,A room or building in which someone may live or stay,The price of the holiday includes flights and accommodation.
deck_008,Algorithm,/ˈæl.ɡə.rɪ.ðəm/,noun,A set of mathematical instructions or rules,The new algorithm processes data twice as fast as the old one.
deck_008,Deploy,/dɪˈplɔɪ/,verb,To put something into use,The development team will deploy the new application on Friday.